{
  "$schema": "https://json-schema.org/draft/2020-12/schema",
  "$id": "https://gssk.io/schema/v3/model.json",
  "title": "GSK Model (Schema v3)",
  "description": "Schema for General Systems Kernel (GSK) models. Based on Odum's Energy Systems Language. Each inter-block connection carries four channels (Odum 2000, Appendix A): Code (carrier), Force (driving potential, implicit in logic+Q), Flow (rate, computed by logic), and Transformity (quality ratio, computed from quality_input). Schema v3 adds metadata versioning, snapshot support for deterministic replay, topology mutation logging, and multi-carrier declarations.",
  "type": "object",
  "required": ["nodes"],
  "additionalProperties": false,

  "properties": {
    "metadata": { "$ref": "#/$defs/Metadata" },
    "nodes":    {
      "type": "array",
      "items": { "$ref": "#/$defs/Node" },
      "minItems": 1,
      "description": "Ordered array of compartments. The index of each node here is its column index in GSK_GetState()."
    },
    "edges":    {
      "type": "array",
      "items": { "$ref": "#/$defs/Edge" },
      "description": "Directed flows between nodes. Omit for a single isolated storage."
    },
    "config":   { "$ref": "#/$defs/Config" },
    "snapshot": { "$ref": "#/$defs/Snapshot" },
    "mutation_log": { "$ref": "#/$defs/MutationLog" },
    "carriers": { "$ref": "#/$defs/Carriers" }
  },

  "$defs": {

    "Metadata": {
      "type": "object",
      "description": "Model provenance, versioning, and identity. schema_version is required in v3.",
      "required": ["schema_version"],
      "additionalProperties": false,
      "properties": {
        "schema_version": {
          "type": "integer",
          "const": 3,
          "description": "Schema version. v3 supports snapshot/mutation_log/carriers blocks and metadata extensions. v2 models will auto-migrate with warning."
        },
        "name":            { "type": "string", "description": "Friendly model name." },
        "description":     { "type": "string", "description": "Prose model description." },
        "author":          { "type": "string", "description": "Serialiser or author name." },
        "created_at":      { "type": "string", "format": "date-time", "description": "ISO8601 creation timestamp. Auto-generated if not provided." },
        "kernel_version":  { "type": "string", "description": "Semver of GSK kernel that created this model. Defaults to current kernel version at init time." },
        "model_hash":      { "type": "string", "description": "SHA256 hex hash of the topology (nodes+edges) for reproducibility check. Auto-computed if not provided." }
      }
    },

    "Snapshot": {
      "type": "object",
      "description": "State snapshot for deterministic replay (implemented in Phase 0.3). Contains full state vector, solver state, and RNG seed.",
      "additionalProperties": false
    },

    "MutationLog": {
      "type": "array",
      "description": "Topology mutation history (implemented in Phase 4). Each entry records a successful AddNode/AddEdge/SetEdgeK operation with causality.",
      "items": { "type": "object" }
    },

    "Carriers": {
      "type": "array",
      "description": "Multi-carrier type definitions (implemented in Phase 5). Each carrier can be conserved independently.",
      "items": {
        "type": "object",
        "required": ["id"],
        "additionalProperties": false,
        "properties": {
          "id":        { "type": "string", "description": "Unique carrier identifier (e.g. 'money', 'energy', 'material')." },
          "unit":      { "type": "string", "description": "Physical unit (e.g. 'AUD', 'kWh', 'kg')." },
          "conserved": { "type": "boolean", "default": true, "description": "Whether this carrier obeys conservation law within isolated sub-systems." }
        }
      }
    },

    "Node": {
      "type": "object",
      "description": "A compartment (storage, source, sink, or constant reference value).",
      "required": ["id", "type", "value"],
      "additionalProperties": false,
      "properties": {
        "id": {
          "type": "string",
          "minLength": 1,
          "maxLength": 63,
          "description": "Unique identifier. Max 63 chars (C internal limit). Stable across model mutations."
        },
        "type": {
          "type": "string",
          "enum": ["storage", "source", "sink", "constant"],
          "description": "storage: dQ/dt computed. source/constant: Q fixed at value. sink: accumulates inflows, not depleted."
        },
        "value": {
          "type": "number",
          "description": "Initial state Q at t_start, or fixed value for source/constant nodes."
        },
        "quality_input": {
          "type": "number",
          "minimum": 0.0,
          "description": "Odum Position 4 (Transformity) at system boundary. Solar transformity convention: 1.0 for solar. Set on source/constant nodes to enable the quality accounting pass. Units are domain-defined (e.g. sej/J, sej/$, or dimensionless). Omit to disable quality accounting for this source."
        },
        "output_mode": {
          "type": "string",
          "enum": ["partition", "replicate"],
          "default": "partition",
          "description": "How quality propagates at bifurcations from this node. partition: quality divides proportionally to flow (Bastianoni split). replicate: each downstream branch receives the full quality (Bastianoni co-product). Does NOT affect ODE integration."
        },
        "visual": {
          "type": "object",
          "additionalProperties": true,
          "description": "UI layout hints. Ignored by the kernel."
        }
      }
    },

    "Edge": {
      "type": "object",
      "description": "A directed flow between two nodes. Implements Odum's four-position inter-block connection: carrier (Code), logic+Q (Force+Flow), quality_input on origin node (Transformity).",
      "required": ["origin", "target", "logic", "params"],
      "additionalProperties": false,
      "properties": {
        "id": {
          "type": "string",
          "description": "Stable identifier. Required for GSSK_SetEdgeK(), GSSK_DeactivateEdge(), and coupled_edge references."
        },
        "origin": {
          "type": "string",
          "description": "ID of the node the flow leaves."
        },
        "target": {
          "type": "string",
          "description": "ID of the node the flow enters."
        },
        "carrier": {
          "type": "string",
          "description": "Odum Position 1 (Code): what substance or entity is flowing. Free string — use domain conventions: 'energy', 'money', 'material', 'information', 'force', or specific types ('H2O', 'GBP', 'bits'). Does NOT affect ODE integration. Used by quality accounting pass and UI."
        },
        "logic": {
          "type": "string",
          "enum": ["constant", "linear", "interaction", "limit", "threshold"],
          "description": "Flow calculation type. Encodes Odum Position 2 (Force) and Position 3 (Flow) jointly."
        },
        "params": { "$ref": "#/$defs/EdgeParams" },
        "output_mode": {
          "type": "string",
          "enum": ["partition", "replicate"],
          "default": "partition",
          "description": "Quality propagation mode for this specific edge. Overrides the origin node's output_mode for this edge only."
        },
        "coupled_edge": {
          "type": ["string", "null"],
          "default": null,
          "description": "ID of a paired counter-flow edge. Used to model commodity-payment pairs where money flows opposite to goods (e.g. 'salary_payment' coupled with 'labour_delivery'). Kernel uses this for quality accounting directionality."
        },
        "visual": {
          "type": "object",
          "additionalProperties": true,
          "description": "UI layout hints. Ignored by the kernel."
        }
      }
    },

    "EdgeParams": {
      "type": "object",
      "description": "Logic-specific flow parameters.",
      "required": ["k"],
      "additionalProperties": false,
      "properties": {
        "k": {
          "type": "number",
          "description": "Conductance/rate coefficient. Modifiable at runtime via GSSK_SetEdgeK(). For constant logic: flow = k. For linear: flow = k × Q_origin."
        },
        "control_node": {
          "type": "string",
          "description": "Required for interaction and limit logic. ID of the node whose Q value modulates the flow."
        },
        "threshold": {
          "type": "number",
          "default": 0.0,
          "description": "Required for threshold logic. Flow = k if Q_origin > threshold, else 0."
        }
      }
    },

    "Config": {
      "type": "object",
      "description": "Simulation parameters. All fields optional — defaults shown.",
      "additionalProperties": false,
      "properties": {
        "t_start": {
          "type": "number",
          "default": 0.0,
          "description": "Simulation start time."
        },
        "t_end": {
          "type": "number",
          "default": 100.0,
          "description": "Simulation end time. Must be > t_start."
        },
        "dt": {
          "type": "number",
          "exclusiveMinimum": 0,
          "default": 0.1,
          "description": "Time step. Must be > 0."
        },
        "method": {
          "type": "string",
          "enum": ["auto", "euler", "rk4", "incipient"],
          "default": "auto",
          "description": "Integration method. auto: kernel selects incipient where eligible (all-constant/linear/interaction edges), RK4 otherwise, with dual-solver verification. euler/rk4: force specific solver (debugging). incipient: force IDC (testing only — falls back to RK4 for limit/threshold edges)."
        },
        "solver_tolerance": {
          "type": "number",
          "default": 1e-6,
          "description": "Maximum relative error between IDC and RK4 before dual-solver confidence degrades to DEGRADED and k-adjustments are frozen. Only used in auto mode."
        }
      }
    }
  }
}
