{
    "metadata": {
        "schema_version": 3,
        "name": "Simple Model",
        "description": "Minimal linear flow from a source into a storage node.",
        "kernel_version": "3.0.0"
    },
    "nodes": [
        {
            "id": "sun",
            "type": "source",
            "value": 100.0
        },
        {
            "id": "grass",
            "type": "storage",
            "value": 10.0
        }
    ],
    "edges": [
        {
            "id": "production",
            "origin": "sun",
            "target": "grass",
            "logic": "linear",
            "params": {
                "k": 0.1
            }
        }
    ],
    "config": {
        "t_start": 0.0,
        "t_end": 10.0,
        "dt": 0.1,
        "method": "euler"
    }
}